{
  "app": "rasa.app.v1",
  "id": "orders-desk",
  "name": "Orders Desk",
  "version": "0.2.0",
  "created": "2026-07-08",
  "screens": [
    { "id": "home", "title": "Overview", "default": true },
    { "id": "orders", "title": "Orders" }
  ],
  "active_screen": "orders",
  "data_sources": [
    { "path": "../../data/orders.csv", "purpose": "orders table" }
  ],
  "events": [
    { "action": "nav:home", "emits": ["nav"], "handling": "SWITCH_SCREEN home" },
    { "action": "nav:orders", "emits": ["nav"], "handling": "SWITCH_SCREEN orders" },
    { "action": "order_opened", "emits": ["actions"], "handling": "read the newest order from the source, bake its detail into the orders screen, publish" },
    { "action": "refresh_requested", "emits": ["actions"], "handling": "re-derive data/orders-summary.json from the source, bake fresh numbers into both screens, publish the active one" }
  ]
}
